{
  "numero_fatura": "FAT-2026-00125",
  "data_emissao": "2026-02-10",
  "data_vencimento": "2026-02-25",
  "empresa_emissora": {
    "nome": "Tech Solutions Brasil Ltda",
    "cnpj": "12.345.678/0001-90",
    "endereco": "Rua das Tecnologias, 1500 - Florianopolis - SC"
  },
  "cliente": {
    "nome": "Contabil Moderna",
    "cnpj": "98.765.432/0001-55",
    "endereco": "Av. Empresarial, 220 - Florianopolis - SC"
  },
  "itens": [
    {
      "descricao": "Desenvolvimento de Portal Contabil",
      "quantidade": 1,
      "valor_unitario_centavos": 350000,
      "valor_total_item_centavos": 350000
    },
    {
      "descricao": "Hospedagem Premium Anual",
      "quantidade": 1,
      "valor_unitario_centavos": 120000,
      "valor_total_item_centavos": 120000
    },
    {
      "descricao": "Suporte Tecnico Mensal",
      "quantidade": 3,
      "valor_unitario_centavos": 30000,
      "valor_total_item_centavos": 90000
    }
  ],
  "tributos": [
    {
      "tipo": "ISS",
      "valor_centavos": 17500
    },
    {
      "tipo": "PIS",
      "valor_centavos": 5775
    },
    {
      "tipo": "COFINS",
      "valor_centavos": 26600
    }
  ],
  "subtotal_itens_centavos": 560000,
  "valor_total_fatura_centavos": 586675
}
